<?xml version="1.0" encoding="UTF-8"?>
<logbarang xmlns:xsi="http://www.w3.org/2001/XMLSchema-instance" xsi:noNamespaceSchemaLocation="barang.xsd">
<barang>
	<kode>M11122</kode>
	<satuan>rupiah</satuan>
	<harga>5000</harga>
	<asal>
		<pt>ladyrock</pt>
		<kodewil>10</kodewil>
	</asal>
	<tujuan>
		<pt>union</pt>
		<kodewil>1001</kodewil>
	</tujuan>
</barang>
<barang>
	<kode>M1122</kode>
	<satuan>pc</satuan>
	<harga>1000</harga>
	<asal>
		<pt>pbm</pt>
		<kodewil>103</kodewil>
	</asal>
	<tujuan>
		<pt>mitra kencana</pt>
		<kodewil>300</kodewil>
	</tujuan>
</barang>
</logbarang>